{
  "version": "1.2",
  "name": "Demo VopFlow",
  "metadata": {
    "author": "Demo",
    "createdAt": "2023-10-01T00:00:00Z",
    "updatedAt": "2026-02-15T00:00:00Z"
  },
  "nodes": [
    {
      "id": "start",
      "type": "start",
      "position": { "x": 100, "y": 50 },
      "data": {
        "label": "Start"
      }
    },
    {
      "id": "print1",
      "type": "function-call",
      "position": { "x": 100, "y": 150 },
      "data": {
        "label": "print",
        "target": "micropython",
        "function": "print",
        "inputs": {
          "message": { "default": "Hello World" }
        }
      }
    }
  ],
  "edges": [
    {
      "id": "edge-1",
      "source": "start",
      "target": "print1",
      "sourceHandle": "control-out",
      "targetHandle": "control-in",
      "animated": false,
      "label": "",
      "metadata": {
        "flowType": "control-flow"
      }
    }
  ]
}
